{
  "schema_version": "0.1",
  "request_id": "pr21-match-example",
  "action": "match_reputation",
  "payload": {
    "report": {"targets": [{"target_id": "example:11", "object_type": "SOFTWARE", "name": "Example Synthetic App 11"}]},
    "seed_path": "examples/reputation/seed_records.zh-CN.json"
  }
}
